{"artifactCount":13,"artifacts":[{"artifactId":"bundle-readme","licenseSpdx":"MIT","mediaType":"text/markdown; charset=utf-8","path":"README.md","provenance":{"dependsOnArtifactIds":[],"derivation":"authored","sourceReferenceId":"oridesign-neg-tree-candidates-v1","sourceUse":"project-authored"},"role":"readme","sha256":"sha256:65f8699daabff8c179a3aac4077b57c321329b10032dc93a03cf4786a428ad3c"},{"artifactId":"source-duplicate-node-id","licenseSpdx":"MIT","mediaType":"application/json","path":"duplicate-node-id.json","provenance":{"dependsOnArtifactIds":[],"derivation":"authored","sourceReferenceId":"oridesign-neg-tree-candidates-v1","sourceUse":"project-authored"},"role":"negative-source","sha256":"sha256:289610982ab8a25ecb6a0ca309332943496a97f6d4d127647c827ac4b13356d4"},{"artifactId":"source-duplicate-edge-id","licenseSpdx":"MIT","mediaType":"application/json","path":"duplicate-edge-id.json","provenance":{"dependsOnArtifactIds":[],"derivation":"authored","sourceReferenceId":"oridesign-neg-tree-candidates-v1","sourceUse":"project-authored"},"role":"negative-source","sha256":"sha256:7701adec1ef4333bba2f60f4fb7a1898b11608cae062dec9d67f0a7c3d28b42f"},{"artifactId":"source-duplicate-id-namespace","licenseSpdx":"MIT","mediaType":"application/json","path":"duplicate-id-namespace.json","provenance":{"dependsOnArtifactIds":[],"derivation":"authored","sourceReferenceId":"oridesign-neg-tree-candidates-v1","sourceUse":"project-authored"},"role":"negative-source","sha256":"sha256:c62427c2bf4f6906c081e61977ae68229b392867cb9fffe3d105e0a3c781c5fd"},{"artifactId":"source-self-loop","licenseSpdx":"MIT","mediaType":"application/json","path":"self-loop.json","provenance":{"dependsOnArtifactIds":[],"derivation":"authored","sourceReferenceId":"oridesign-neg-tree-candidates-v1","sourceUse":"project-authored"},"role":"negative-source","sha256":"sha256:d1b8513a07b450bcc07ed086ac90f3f6b5f81e246a854757a1dc45ba63cc9ba3"},{"artifactId":"source-parallel-edge","licenseSpdx":"MIT","mediaType":"application/json","path":"parallel-edge.json","provenance":{"dependsOnArtifactIds":[],"derivation":"authored","sourceReferenceId":"oridesign-neg-tree-candidates-v1","sourceUse":"project-authored"},"role":"negative-source","sha256":"sha256:4b88cac410c8d35787182ec1c80cbba9c4acc626ddf6d4d4759c88b144c1a132"},{"artifactId":"source-cycle","licenseSpdx":"MIT","mediaType":"application/json","path":"cycle.json","provenance":{"dependsOnArtifactIds":[],"derivation":"authored","sourceReferenceId":"oridesign-neg-tree-candidates-v1","sourceUse":"project-authored"},"role":"negative-source","sha256":"sha256:60cedac398f1ce201517fc50b4284f44e39d44f3ed840c3d22829a208e9ab655"},{"artifactId":"source-disconnected","licenseSpdx":"MIT","mediaType":"application/json","path":"disconnected.json","provenance":{"dependsOnArtifactIds":[],"derivation":"authored","sourceReferenceId":"oridesign-neg-tree-candidates-v1","sourceUse":"project-authored"},"role":"negative-source","sha256":"sha256:1aa0c99b1ce35ddc6ff84a2832b47c207810a111632f88e54c90fe5fbd23e489"},{"artifactId":"source-nonpositive-length","licenseSpdx":"MIT","mediaType":"application/json","path":"nonpositive-length.json","provenance":{"dependsOnArtifactIds":[],"derivation":"authored","sourceReferenceId":"oridesign-neg-tree-candidates-v1","sourceUse":"project-authored"},"role":"negative-source","sha256":"sha256:b788209dd09fe44363c844b19d9f9e0b9c3a2ebcb6121637a822373e404cf3f5"},{"artifactId":"source-negative-width","licenseSpdx":"MIT","mediaType":"application/json","path":"negative-width.json","provenance":{"dependsOnArtifactIds":[],"derivation":"authored","sourceReferenceId":"oridesign-neg-tree-candidates-v1","sourceUse":"project-authored"},"role":"negative-source","sha256":"sha256:960c22d457b9c3cfd5c722ded99df770855599c46f2f683859e0ce63c8b3bea3"},{"artifactId":"source-rotation-coverage-missing","licenseSpdx":"MIT","mediaType":"application/json","path":"rotation-coverage-missing.json","provenance":{"dependsOnArtifactIds":[],"derivation":"authored","sourceReferenceId":"oridesign-neg-tree-candidates-v1","sourceUse":"project-authored"},"role":"negative-source","sha256":"sha256:8fd3709a2026be69b59f37130b1feda95687eb4be6ffcc1e1dafdfbf5e57b028"},{"artifactId":"source-rotation-incidence-mismatch","licenseSpdx":"MIT","mediaType":"application/json","path":"rotation-incidence-mismatch.json","provenance":{"dependsOnArtifactIds":[],"derivation":"authored","sourceReferenceId":"oridesign-neg-tree-candidates-v1","sourceUse":"project-authored"},"role":"negative-source","sha256":"sha256:e56b93468e799447262e1151df25c123568d6bb613ca966fd1210ca6642ae290"},{"artifactId":"source-leaf-count-out-of-range","licenseSpdx":"MIT","mediaType":"application/json","path":"leaf-count-out-of-range.json","provenance":{"dependsOnArtifactIds":[],"derivation":"authored","sourceReferenceId":"oridesign-neg-tree-candidates-v1","sourceUse":"project-authored"},"role":"negative-source","sha256":"sha256:eed3434f34af7bae41bed1544f3dd2916c12a7d52b1de502bffd290527cf5182"}],"canonicalManifestPath":"tests/fixtures/manifest.json","canonicalManifestRegistration":"not-registered","canonicalPromotionClaimed":false,"caseCount":12,"cases":[{"caseId":"NEG-TREE-DUPLICATE-NODE-ID","caseIndex":0,"changedPaths":["$.nodes[1].id"],"controlId":"primary-star-four-leaf-control-v1","expectedIssues":[{"code":"duplicate-id","path":"$.nodes[1].id"},{"code":"edge-count-mismatch","path":"$.edges"},{"code":"missing-reference","path":"$.edges[1].to"},{"code":"missing-reference","path":"$.rotation[1].nodeId"},{"code":"rotation-incidence-mismatch","path":"$.rotation[2].edgeIds"},{"code":"rotation-coverage-mismatch","path":"$.rotation"}],"expectedOutcome":"rejected","mutationKind":"replace-node-id-with-existing-node-id","sourceArtifactId":"source-duplicate-node-id","sourcePath":"duplicate-node-id.json"},{"caseId":"NEG-TREE-DUPLICATE-EDGE-ID","caseIndex":1,"changedPaths":["$.edges[1].id"],"controlId":"primary-star-four-leaf-control-v1","expectedIssues":[{"code":"duplicate-id","path":"$.edges[1].id"},{"code":"edge-count-mismatch","path":"$.edges"},{"code":"tree-disconnected","path":"$"},{"code":"missing-reference","path":"$.rotation[1].edgeIds[0]"},{"code":"rotation-incidence-mismatch","path":"$.rotation[1].edgeIds"},{"code":"missing-reference","path":"$.rotation[2].edgeIds[1]"},{"code":"rotation-incidence-mismatch","path":"$.rotation[2].edgeIds"}],"expectedOutcome":"rejected","mutationKind":"replace-edge-id-with-existing-edge-id","sourceArtifactId":"source-duplicate-edge-id","sourcePath":"duplicate-edge-id.json"},{"caseId":"NEG-TREE-DUPLICATE-ID-NAMESPACE","caseIndex":2,"changedPaths":["$.edges[0].id"],"controlId":"primary-star-four-leaf-control-v1","expectedIssues":[{"code":"duplicate-id","path":"$.edges[0].id"},{"code":"edge-count-mismatch","path":"$.edges"},{"code":"tree-disconnected","path":"$"},{"code":"missing-reference","path":"$.rotation[0].edgeIds[0]"},{"code":"rotation-incidence-mismatch","path":"$.rotation[0].edgeIds"},{"code":"missing-reference","path":"$.rotation[2].edgeIds[0]"},{"code":"rotation-incidence-mismatch","path":"$.rotation[2].edgeIds"}],"expectedOutcome":"rejected","mutationKind":"replace-edge-id-with-existing-node-id","sourceArtifactId":"source-duplicate-id-namespace","sourcePath":"duplicate-id-namespace.json"},{"caseId":"NEG-TREE-SELF-LOOP","caseIndex":3,"changedPaths":["$.edges[4]"],"controlId":"primary-star-four-leaf-control-v1","expectedIssues":[{"code":"edge-count-mismatch","path":"$.edges"},{"code":"tree-self-loop","path":"$.edges[4]"}],"expectedOutcome":"rejected","mutationKind":"append-self-loop-edge","sourceArtifactId":"source-self-loop","sourcePath":"self-loop.json"},{"caseId":"NEG-TREE-PARALLEL-EDGE","caseIndex":4,"changedPaths":["$.edges[4]","$.rotation[0].edgeIds[1]","$.rotation[2].edgeIds[4]"],"controlId":"primary-star-four-leaf-control-v1","expectedIssues":[{"code":"edge-count-mismatch","path":"$.edges"},{"code":"tree-parallel-edge","path":"$.edges[4]"},{"code":"tree-cycle","path":"$.edges[4]"}],"expectedOutcome":"rejected","mutationKind":"append-parallel-edge-and-incidence","sourceArtifactId":"source-parallel-edge","sourcePath":"parallel-edge.json"},{"caseId":"NEG-TREE-CYCLE","caseIndex":5,"changedPaths":["$.edges[4]","$.rotation[0].edgeIds[1]","$.rotation[1].edgeIds[1]"],"controlId":"primary-star-four-leaf-control-v1","expectedIssues":[{"code":"edge-count-mismatch","path":"$.edges"},{"code":"tree-cycle","path":"$.edges[4]"}],"expectedOutcome":"rejected","mutationKind":"append-cycle-closing-edge-and-incidence","sourceArtifactId":"source-cycle","sourcePath":"cycle.json"},{"caseId":"NEG-TREE-DISCONNECTED","caseIndex":6,"changedPaths":["$.edges[3]","$.rotation[2].edgeIds[3]","$.rotation[4].edgeIds[0]"],"controlId":"primary-star-four-leaf-control-v1","expectedIssues":[{"code":"edge-count-mismatch","path":"$.edges"},{"code":"tree-disconnected","path":"$"}],"expectedOutcome":"rejected","mutationKind":"remove-terminal-edge-and-incidence","sourceArtifactId":"source-disconnected","sourcePath":"disconnected.json"},{"caseId":"NEG-TREE-NONPOSITIVE-LENGTH","caseIndex":7,"changedPaths":["$.edges[0].length"],"controlId":"primary-star-four-leaf-control-v1","expectedIssues":[{"code":"invalid-bound","path":"$.edges[0].length"},{"code":"edge-count-mismatch","path":"$.edges"},{"code":"tree-disconnected","path":"$"},{"code":"missing-reference","path":"$.rotation[0].edgeIds[0]"},{"code":"rotation-incidence-mismatch","path":"$.rotation[0].edgeIds"},{"code":"missing-reference","path":"$.rotation[2].edgeIds[0]"},{"code":"rotation-incidence-mismatch","path":"$.rotation[2].edgeIds"}],"expectedOutcome":"rejected","mutationKind":"replace-length-with-zero","sourceArtifactId":"source-nonpositive-length","sourcePath":"nonpositive-length.json"},{"caseId":"NEG-TREE-NEGATIVE-WIDTH","caseIndex":8,"changedPaths":["$.edges[0].width"],"controlId":"primary-star-four-leaf-control-v1","expectedIssues":[{"code":"invalid-bound","path":"$.edges[0].width"},{"code":"edge-count-mismatch","path":"$.edges"},{"co